1,1,Bon Jovi Concert, Bon Jovi in concert la Sala Palatului This House is not For Sale Tour 2019,22/1/2019,22/1/2019,1,Sala Palatului,Bucuresti,Romania,Bon Jovi
1,2,Ed Sheeran Concert, Ed Sheeran concerteaza in Romania, 3/7/1019, 4/7/2019,7,Arena Nationala,Bucuresti,Romania,Ed Sheeran
1,3,Enrique Iglesias Concert,Enrique Iglesias  concerteaza in Cluj Napoca, 29/10/1019, 30/10/2019,8,BT Arena,Cluj,Romania,Enrique Iglesias
1,4,The Cure Concert, The Cure si Editors concerteaza in Romania in cadrul God is an astronaut Tour 2019, 3/7/1019, 4/7/2019,8,Piata Constitutiei,Bucuresti,Romania,The Cure,Editors
1,5,Lenny Kravitz,  Lenny Kravitz revine în Romania pentru un concert în premieră în Cluj-Napoca. Artistul a decis ca după întâlnirea din 2008 din București să ofere românilor o nouă seară de neuitat., 3/5/1019, 4/5/2019,9,Sala Polivalenta,Cluj,Romania,Lenny Kravitz
1,6,Lara Fabian,Mult indragita artista Lara Fabian a vandut peste 20 milioane de albume in intreaga lume iar anul acesta revine cu un nou turneu mondial “50 World Tour”., 18/11/2020, 18/11/2020,1,Sala Palatului,Bucuresti,Romania,Lara Fabian